{
  "title": "Azure 更新管理器",
  "metaTitle": "",
  "metaDescription": "了解 Azure 密钥保管库（Key Vault）价格详情。通过 Azure 密钥保管库（Key Vault），Azure 用户能够保护和控制云应用程序和服务使用的加密密钥和其他机密。1元试用即获1500元人民币的服务使用额度，也可直接购买成为 Azure 预付费客户，尽享最高 99.99% 的服务级别协议。",
  "metaKeywords": "Azure, 密钥保管库, 价格",
  "slug": "azure-update-management-center",
  "language": "zh-cn",
  "baseContent": "<div class=\"technical-azure-selector tab-control-selector\"><div class=\"tab-control-container tab-active\"><h2> Azure 更新管理器 </h2><p>对于已启用 Arc 的服务器，Azure 更新管理器将根据 ￥1.03/服务器/天的价格每天按比例计费，此价格相当于 ￥31.8/服务器/月(假设连接使用 31 天)。由 Azure Arc 启用的计算机只有在连接到 Arc 并由 Azure 更新管理器管理时才计费。 <a href=\"https://learn.microsoft.com/zh-cn/azure/update-manager/update-manager-faq#when-is-an-arc-enabled-server-considered-managed-by-azure-update-manager\" target=\"_blank\">详细了解计算机何时由 Azure 更新管理器管理。</a></p><p> 单击此处详细了解 <a href=\"https://learn.microsoft.com/zh-cn/azure/update-manager/update-manager-faq#pricing\" target=\"_blank\">Azure 更新管理器常见问题解答 | Microsoft Learn</a>。</p><br/><br/><table cellpadding=\"0\" cellspacing=\"0\" class=\"table-col6\" width=\"100%\"><tr><th align=\"left\"><strong> 服务 </strong></th><th align=\"left\"><strong> Azure </strong></th><th align=\"left\"><strong> 已启用Arc </strong></th></tr><tr><td> Azure 更新管理器 </td><td> 免费 </td><td> ￥31.8/服务器/月 </td></tr></table></div></div>",
  "contentGroups": [],
  "commonSections": [
    {
      "sectionType": "Banner",
      "sectionTitle": "Banner",
      "content": "<div class=\"common-banner col-top-banner\" data-config=\"{'backgroundColor':'#e3f4ff', 'backgroundImage':'{base_url}/Images/marketing-resource/media/images/production/virtual_machine.png','imageHeight':'auto'}\"><div class=\"common-banner-image\"><div class=\"common-banner-title\"><img src=\"{base_url}/Images/02846-icon-service-Update-Management-Center.svg\"/><h2> Azure 更新管理器 <span></span></h2><h4> Azure 更新管理器是一项服务，可帮助你跨 Azure、本地和其他云平台管理所有计算机(包括运行 Windows 和 Linux 的计算机)的更新。 </h4></div></div></div>",
      "sortOrder": 1,
      "isActive": true
    },
    {
      "sectionType": "Qa",
      "sectionTitle": "Qa",
      "content": "<div class=\"more-detail\"><h2> 常见问题 </h2><em> 全部展开 </em><ul><li><i class=\"icon icon-plus\"></i><div><a id=\"key-vault-question-stored\"> 如何为已启用 Arc 的服务器计算 Azure 更新管理器价格? </a><section><p>对于已启用 Arc 的服务器，Azure 更新管理器费用为 $31.8/服务器/月(假定连接使用时间为 31 天)。按每日按 ￥1.03/服务器/日的比例值收费。启用 Azure Arc 的计算机仅在连接到并由 Azure 更新管理器管理的情况下才收费。</p></section></div></li><li><i class=\"icon icon-plus\"></i><div><a id=\"key-vault-question-stored2\"> 启用 Arc 的服务器何时被视为由 Azure 更新管理器管理? </a><section><p>当机器满足以下条件时，Azure 更新管理器将认为 Arc 启用的服务器由其管理：</p><ul><li>Arc 在一天中的任何时间的连接状态。</li><li>会触发更新操作(按需或通过计划作业进行修补、按需评估或定期评估)，或者其与计划相关联。</li></ul></section></div></li><li><i class=\"icon icon-plus\"></i><div><a id=\"key-vault-question-stored3\"> 是否存在未为 Azure 更新管理器收取已启用 Arc 的服务器的费用的情况? </a><section><p>在以下情况下，不对使用 Azure 更新管理器管理的已启用 Arc 的服务器收费：</p><ul><li>如果机器启用了 Azure Arc 启用的扩展安全更新 (ESU)。</li><li>托管启用 Arc 的服务器的订阅已启用 Microsoft Defender for Servers Plan 2。</li></ul></section></div></li><li><i class=\"icon icon-plus\"></i><div><a id=\"key-vault-question-stored4\"> 如果从自动化更新管理迁移到更新管理器，是否会向我收费? </a><section><p>在以下情况下，不对使用 Azure 更新管理器管理的已启用 Arc 的服务器收费：</p> 在 LA 代理停用之前，如果客户将已启用 Arc 的服务器加入到启用了自动更新管理解决方案的同一订阅，则不用支付费用(截至 2023 年 9 月 1 日)。 </section></div></li><li><i class=\"icon icon-plus\"></i><div><a id=\"key-vault-question-operations\"> 我是 Defender for Server 客户，使用 Azure 更新管理器支持的更新建议，即“应在计算机上启用定期评估”和“应在计算机上安装系统更新”。是否会向我收取 Azure 更新管理器费用? </a><section><p> 如果已购买 Defender for Servers 计划 2，则无需支付费用即可修正上述两项建议的不正常资源。但是，如果为 Arc 计算机使用任何其他 Defender for Server 计划，则 Azure 更新管理器将在每日按 ￥1.03/服务器比例对这些计算机收费。</p></section></div></li><li><i class=\"icon icon-plus\"></i><div><a id=\"key-vault-question-billed\"> Azure 更新管理器在 Azure Stack HCI 上是否收费? </a><section><p> 对于已启用 Azure 权益和 Azure Arc VM 管理的 Azure Stack HCI 群集上托管的计算机，不会对 Azure 更新管理器收费。<a href=\"https://learn.microsoft.com/zh-cn/azure-stack/hci/manage/azure-benefits?tabs=wac\" target=\"_blank\">了解详细信息</a></p></section></div></li></ul></div>",
      "sortOrder": 2,
      "isActive": true
    }
  ],
  "pageConfig": {
    "displayTitle": "Azure 更新管理器",
    "pageIcon": "{base_url}/Static/Favicon/favicon.ico",
    "leftNavigationIdentifier": "azure-update-management-center",
    "pageType": "Simple",
    "enableFilters": false,
    "filtersJsonConfig": "{\"filterDefinitions\":[]}"
  }
}
