{
  "title": "Azure Migrate",
  "metaTitle": "",
  "metaDescription": "了解 Azure云服务（Cloud Service）部署应用程序和 API 的价格详情。Azure 云服务分为 A 系列和 D 系列两种类型，无需预付，即用即付。1元试用即获1500元人民币的服务使用额度，也可直接购买成为 Azure 预付费客户。",
  "metaKeywords": "Azure 云服务, Cloud Service, 价格页面",
  "slug": "azure-migrate",
  "language": "zh-cn",
  "baseContent": "<h2> 定价详细信息 </h2><h3> 应用筛选器来根据你的需求自定义定价选项。 </h3><div class=\"tab-content\"><table cellpadding=\"0\" cellspacing=\"0\" class=\"speech-services-table\" id=\"cognitive-services-table-speech-services-neural\" width=\"100%\"><tr><th align=\"left\" style=\"width: 40%;\"><strong> 工具 </strong></th><th align=\"left\" style=\"width: 20%;\"><strong> 方案 </strong></th><th align=\"left\" style=\"width: 20%;\"><strong> 定价 </strong></th></tr><tr><td rowspan=\"3\"> Azure Migrate </td><td> 服务器评估和迁移 </td><td> 免费 <sup> 1 </sup></td></tr><tr><td> 数据库评估和迁移 </td><td> 免费 <sup> 2 </sup></td></tr><td> Web 应用评估和迁移 </td><td> 免费 <sup></sup></td></table><p><sup> 1 </sup> 从将 Log Analytics 工作区与服务器评估进行关联之日算起，在前 180 天内，依赖项可视化效果可供免费使用。180 天之后，将收取标准 <a href=\"https://www.azure.cn/zh-cn/pricing/details/monitor/\"> Log Analytics </a> 费用。在此工作区中使用除服务映射外的任何其他解决方案不提供免费服务，并且会产生标准 <a href=\"https://www.azure.cn/zh-cn/pricing/details/monitor/\"> Log Analytics </a> 费用。Azure Migrate: 对于每台计算机，服务器迁移在前 180 天内免费。180 天之后，每个复制的实例将按 $31.301/月的标准收取费用。请注意，前 180 天内不会产生任何服务器迁移许可费用，但复制期间可能会产生 Azure 存储、存储交易和数据传输方面的费用。 </p><p><sup> 2 </sup> 数据库迁移服务 (DMS) 在前 180 天内可供免费使用，如需了解详细信息，请参阅 <a href=\"https://www.azure.cn/zh-cn/pricing/details/database-migration/\"> DMS </a> 定价。 </p></div>",
  "contentGroups": [],
  "commonSections": [
    {
      "sectionType": "Banner",
      "sectionTitle": "Banner",
      "content": "<div class=\"common-banner col-top-banner\" data-config=\"{'backgroundColor':'#e3f4ff', 'backgroundImage':'{base_url}/Images/marketing-resource/css/cloud_services.png','imageHeight':'auto'}\"><div class=\"common-banner-image\"><div class=\"common-banner-title\"><!-- <img src=\"{base_url}/Images/marketing-resource/css/cloud-services@2x.png\" /> --><img src=\"{base_url}/Images/marketing-resource/media/images/production/AzureMigratelogo.svg\"/><h2> Azure Migrate </h2><h4> 发现和评估本地虚拟机 (VM)，将其调整为适当大小并迁移到 Azure </h4></div></div></div>",
      "sortOrder": 1,
      "isActive": true
    },
    {
      "sectionType": "ProductDescription",
      "sectionTitle": "ProductDescription",
      "content": "<ul class=\"ex_ul_container\"><li><h2> 发现和评估本地虚拟机 (VM)，将其调整为适当大小并迁移到 Azure </h2></li><li><ul id=\"in_ul_container\"><li> Azure Migrate 有助于发现和评估应用程序、基础结构和数据，并有助于将其从本地环境迁移到 Azure。可以跨多种 Microsoft 和独立软件供应商 (ISV) 工具，集中跟踪迁移过程的进度。 </li></ul></li></ul>",
      "sortOrder": 2,
      "isActive": true
    }
  ],
  "pageConfig": {
    "displayTitle": "Azure Migrate",
    "pageIcon": "{base_url}/Static/Favicon/favicon.ico",
    "leftNavigationIdentifier": "cloud-services1",
    "pageType": "Simple",
    "enableFilters": false,
    "filtersJsonConfig": "{\"filterDefinitions\":[]}"
  }
}
